parameter,minimum,baseline,maximum,units,description
growth,0.035,0.060,0.095,per_time_step,Uncertain system growth or pressure rate
shock_intensity,0.0,12.0,24.0,state_units,Uncertain external disturbance intensity
shock_timing,20,32,45,time_step,Uncertain timing of external disturbance
policy_strength,0.020,0.040,0.065,share_per_time_step,Strength of intervention pressure
adaptive_capacity,0.005,0.020,0.050,share_per_time_step,Ability of the system to adapt under stress
initial_state,20.0,20.0,20.0,state_units,Initial system state
