pathway,demand_growth,efficiency_gain,clean_growth_early,clean_growth_late,adaptation_investment,transition_cost_factor,equity_support,ecological_constraint,description
baseline_continuation,0.018,0.004,0.010,0.014,0.004,0.30,0.20,0.20,Slow transition and limited adaptation
delayed_transition,0.017,0.006,0.006,0.032,0.006,0.55,0.30,0.25,Mitigation starts late and accelerates later
rapid_decarbonization,0.012,0.012,0.035,0.028,0.010,0.85,0.50,0.35,Clean energy and efficiency scale quickly
adaptation_heavy,0.015,0.007,0.014,0.018,0.022,0.62,0.48,0.30,Adaptation investment is emphasized
equity_centered_transition,0.013,0.010,0.026,0.026,0.016,0.78,0.88,0.40,Transition includes affordability access and vulnerability support
ecological_constraint,0.010,0.011,0.020,0.022,0.014,0.70,0.62,0.85,Land water and ecological limits constrain pathway choices
