group,affected,represented,influence,expected_benefit,expected_burden,description
public_agency,0.40,1,0.95,0.80,0.20,High decision influence and institutional benefit
technical_modelers,0.20,1,0.85,0.65,0.15,High technical influence but lower direct exposure
frontline_workers,0.70,1,0.45,0.55,0.35,Operational knowledge with moderate influence and burden
affected_residents,0.95,1,0.35,0.50,0.60,High exposure and burden with limited influence
low_access_households,1.00,0,0.10,0.35,0.80,High burden and low representation in model governance
future_generations,0.90,0,0.00,0.40,0.75,Long-horizon affected group with no direct representation
local_environment,0.85,0,0.05,0.30,0.70,Ecological burden represented weakly through institutional proxies
